{
  "id": "fase-01",
  "numero": 1,
  "titulo": "Primeiro computador",
  "resumo": "Você juntou R$ 2.500 fazendo bicos e quer entrar na área de tecnologia.",
  "objetivo": "Terminar o mês equipado para estudar, com as contas pagas e sem cair em golpe.",
  "passos": [
    {
      "tipo": "decisao",
      "id": "ponto-de-partida",
      "categoria": "financas",
      "titulo": "O ponto de partida",
      "contexto": "Você tem R$ 2.500 guardados e ainda estuda programação pelo celular. O que faz com esse dinheiro?",
      "dica": "Pergunte duas coisas a cada opção: ela resolve o problema de estudar? Quanto sobra depois?",
      "opcoes": [
        {
          "id": "notebook-usado",
          "texto": "Comprar um notebook usado revisado, com SSD, por R$ 1.600",
          "efeitos": { "dinheiro": -1600, "tecnica": 12, "conhecimento": 3 },
          "merito": 3,
          "aprendizado": "O equipamento resolve o problema e ainda deixa R$ 900 de folga. Ferramenta de trabalho é investimento quando cabe no bolso."
        },
        {
          "id": "notebook-parcelado",
          "texto": "Comprar um notebook novo de R$ 4.800 em 12 parcelas de R$ 400",
          "efeitos": { "dinheiro": -400, "tecnica": 15, "saudeFinanceira": -18 },
          "merito": 1,
          "aprendizado": "A máquina é boa, mas você comprometeu R$ 400 por mês durante um ano sem ter renda fixa. Parcela é dívida: ela continua lá quando o dinheiro acaba."
        },
        {
          "id": "guardar-tudo",
          "texto": "Guardar tudo e continuar estudando pelo celular",
          "efeitos": { "energia": -12, "conhecimento": 2, "saudeFinanceira": 6 },
          "merito": 2,
          "aprendizado": "Guardar é prudente, mas programar no celular custa tempo e energia. Dinheiro parado também tem custo quando falta a ferramenta que faria você avançar."
        },
        {
          "id": "pc-gamer",
          "texto": "Gastar os R$ 2.500 em um PC gamer com luzes RGB",
          "efeitos": { "dinheiro": -2500, "tecnica": 14, "energia": 6, "saudeFinanceira": -15 },
          "merito": 0,
          "aprendizado": "Você ficou sem reserva nenhuma e pagou por um desempenho que programar não exige. Para começar, 8 GB de memória e um SSD importam mais do que placa de vídeo."
        }
      ]
    },
    {
      "tipo": "decisao",
      "id": "o-que-importa",
      "categoria": "tecnologia",
      "titulo": "O que importa na ficha técnica",
      "contexto": "Uma amiga quer um notebook para aprender a programar e manda três opções na mesma faixa de preço. Qual você indica?",
      "dica": "Pense no que fica aberto ao mesmo tempo quando alguém programa: editor, navegador com várias abas e terminal.",
      "opcoes": [
        {
          "id": "memoria-ssd",
          "texto": "O que tem 8 GB de memória e SSD",
          "efeitos": { "conhecimento": 8, "tecnica": 4, "reputacao": 3 },
          "merito": 3,
          "aprendizado": "Memória mantém editor, navegador e terminal abertos ao mesmo tempo; o SSD faz tudo abrir rápido. É o par que mais muda o dia a dia de quem programa."
        },
        {
          "id": "placa-de-video",
          "texto": "O que tem placa de vídeo dedicada",
          "efeitos": { "conhecimento": 2 },
          "merito": 1,
          "aprendizado": "Placa de vídeo pesa em jogos, edição de vídeo e treino de modelos. Para aprender a programar, ela quase não é usada."
        },
        {
          "id": "tela-4k",
          "texto": "O que tem tela 4K de 17 polegadas",
          "efeitos": { "conhecimento": 1 },
          "merito": 0,
          "aprendizado": "Tela boa é conforto, não capacidade. Com pouca memória a máquina trava do mesmo jeito, só que em alta resolução."
        }
      ]
    },
    {
      "tipo": "decisao",
      "id": "internet-em-casa",
      "categoria": "financas",
      "titulo": "Internet para estudar",
      "contexto": "Você precisa de internet em casa para assistir às aulas. Sua família topa dividir a conta. Qual plano você defende?",
      "dica": "Compare o que você realmente usa com o que cada plano entrega, e lembre que custo fixo se repete todo mês.",
      "opcoes": [
        {
          "id": "fibra-dividida",
          "texto": "Fibra de 300 mega por R$ 100, dividida em casa: R$ 50 para você",
          "efeitos": { "dinheiro": -50, "conhecimento": 4, "reputacao": 3 },
          "merito": 3,
          "aprendizado": "Atende aula, videochamada e download sem faltar nem sobrar. Dividir custo fixo é uma das formas mais simples de fazer o dinheiro render."
        },
        {
          "id": "dados-moveis",
          "texto": "Ficar só com o pacote de dados do celular",
          "efeitos": { "energia": -10, "conhecimento": 1 },
          "merito": 0,
          "aprendizado": "Parece economia, mas o pacote acaba no meio da aula e sai caro por giga. Custo baixo que impede você de estudar não é economia."
        },
        {
          "id": "um-giga",
          "texto": "Plano de 1 giga por R$ 250, pago só por você",
          "efeitos": { "dinheiro": -250, "conhecimento": 4, "saudeFinanceira": -8 },
          "merito": 1,
          "aprendizado": "Funciona, mas você paga cinco vezes mais por uma velocidade que estudar não usa. Capacidade ociosa é dinheiro saindo todo mês."
        }
      ]
    },
    {
      "tipo": "orcamento",
      "id": "primeiro-mes",
      "categoria": "financas",
      "titulo": "O orçamento do primeiro mês",
      "contexto": "Você conseguiu uma vaga de jovem aprendiz e vai receber R$ 900 por mês. Marque o que entra no orçamento. O que sobrar vai para a reserva de emergência.",
      "dica": "Comece pelas contas essenciais. Depois veja quanto precisa sobrar para bater a meta de reserva, e só então escolha os desejos.",
      "renda": 900,
      "metaReserva": 100,
      "itens": [
        { "id": "transporte", "nome": "Transporte", "valor": 180, "classe": "essencial" },
        { "id": "internet", "nome": "Sua parte da internet", "valor": 50, "classe": "essencial" },
        { "id": "ajuda-em-casa", "nome": "Ajuda nas contas de casa", "valor": 200, "classe": "essencial" },
        { "id": "curso-logica", "nome": "Curso de lógica de programação", "valor": 60, "classe": "futuro" },
        { "id": "teclado-mouse", "nome": "Teclado e mouse usados", "valor": 70, "classe": "futuro" },
        { "id": "lanche-fora", "nome": "Lanche fora de casa", "valor": 160, "classe": "desejo" },
        { "id": "streaming", "nome": "Assinatura de streaming", "valor": 60, "classe": "desejo" },
        { "id": "jogo-promocao", "nome": "Jogo em promoção", "valor": 80, "classe": "desejo" },
        { "id": "tenis-parcelado", "nome": "Tênis novo, 1ª de 3 parcelas", "valor": 150, "classe": "desejo" }
      ],
      "aprendizado": "Orçamento é decidir antes para onde o dinheiro vai: primeiro o essencial, depois a reserva e o seu futuro, e só então os desejos. Quem deixa a reserva para o que sobrar quase nunca vê sobrar."
    },
    {
      "tipo": "decisao",
      "id": "frete-premiado",
      "categoria": "seguranca",
      "titulo": "A mensagem do prêmio",
      "contexto": "Chega uma mensagem de um número desconhecido: \"Parabéns! Você foi sorteado e ganhou um notebook. Pague só o frete de R$ 49 por Pix em até 10 minutos para garantir.\" O que você faz?",
      "dica": "Repare em três coisas: você entrou em algum sorteio? Por que tanta pressa? Quem pede pagamento adiantado para entregar um prêmio?",
      "opcoes": [
        {
          "id": "pagar-frete",
          "texto": "Pagar o frete antes que o prazo acabe",
          "efeitos": { "dinheiro": -49, "seguranca": -10, "saudeFinanceira": -4 },
          "merito": 0,
          "aprendizado": "Era golpe. Prêmio de sorteio em que você não entrou, pressa e pagamento adiantado são os três sinais clássicos. Pix feito para golpista dificilmente volta."
        },
        {
          "id": "abrir-link",
          "texto": "Abrir o link para ver se o site parece confiável",
          "efeitos": { "seguranca": -6 },
          "merito": 1,
          "aprendizado": "Abrir o link já é um risco: páginas falsas copiam as verdadeiras. Para conferir, procure a empresa por um canal oficial, nunca pelo link que chegou."
        },
        {
          "id": "ignorar",
          "texto": "Ignorar e apagar a mensagem",
          "efeitos": { "seguranca": 5 },
          "merito": 2,
          "aprendizado": "Você não caiu, e isso é o principal. Dá para ir além: denunciar e bloquear o número evita que a mesma mensagem chegue a quem não desconfiaria."
        },
        {
          "id": "denunciar",
          "texto": "Não clicar em nada, denunciar e bloquear o número",
          "efeitos": { "seguranca": 12, "reputacao": 2 },
          "merito": 3,
          "aprendizado": "Você reconheceu os sinais: prêmio inesperado, urgência e pedido de pagamento. Denunciar e bloquear protege você e quem receberia a mesma mensagem depois."
        }
      ]
    }
  ]
}
